ID;Name;Year Published;Min Players;Max Players;Play Time;Min Age;Users Rated;Rating Average;BGG Rank;Complexity Average;Owned Users;Mechanics;Domains
146439;BattleLore (Second Edition);2013;2;2;90;14;5645;7,74;241;2,70;9235;Campaign / Battle Card Driven, Command Cards, Dice Rolling, Grid Movement, Modular Board, Variable Player Powers;Wargames
224783;Vindication;2018;2;5;150;14;4583;7,88;242;3,07;7425;Area Majority / Influence, Dice Rolling, Hexagon Grid, Map Addition, Modular Board, Variable Phase Order;Strategy Games
13122;Antiquity;2004;2;4;180;14;3833;7,88;243;4,31;5508;Grid Coverage, Modular Board, Tile Placement, Trading;Strategy Games
312484;Lost Ruins of Arnak;2020;1;4;120;12;2819;8,25;244;2,76;5281;Chaining, Deck Bag and Pool Building, Drafting, Move Through Deck, Once-Per-Game Abilities, Resource to Move, Tile Placement, Turn Order: Progressive, Worker Placement;Strategy Games
232405;Western Legends;2018;2;6;90;14;6615;7,66;245;2,78;11185;Action Points, Area Movement, Betting and Bluffing, Dice Rolling, End Game Bonuses, Hand Management, Pick-up and Deliver, Take That, Variable Player Powers;Thematic Games
139976;Cthulhu Wars;2015;2;4;120;14;4585;7,92;246;3,14;5729;Action Points, Area Majority / Influence, Area Movement, Dice Rolling, Variable Player Powers;Strategy Games, Thematic Games
2655;Hive;2000;2;2;20;9;29596;7,32;247;2,33;38724;Enclosure, Grid Movement, Hexagon Grid, Pieces as Map, Slide/Push, Three Dimensional Movement, Tile Placement;Abstract Games
160477;Onitama;2014;2;2;20;8;15161;7,40;248;1,71;22904;Grid Movement, Hand Management, Pattern Movement, Static Capture;Abstract Games
206718;Ethnos;2017;2;6;60;14;9741;7,48;249;2,03;12131;Area Majority / Influence, Card Drafting, Hand Management, Set Collection;Strategy Games
101721;Mage Wars Arena;2012;2;2;90;13;7379;7,64;250;3,67;12922;Deck Construction, Dice Rolling, Grid Movement, Line of Sight, Simultaneous Action Selection, Turn Order: Progressive, Variable Player Powers;Customizable Games